{
  "id": "gate-d1-temp-onboarding-retention",
  "version": 1,
  "status": "published",
  "blockId": "D1",
  "coveredLessonIds": [
    "d1-feedback-matrix",
    "d1-five-whys",
    "d1-script-from-hypotheses",
    "d1-question-craft",
    "d1-heart-metrics",
    "d1-frequency-adoption"
  ],
  "title": "«Темп»: онбординг короче, удержание ниже",
  "summary": "Регистраций стало больше, а недельное удержание упало. Решите, что рекомендовать завтра.",
  "estimatedMinutes": 10,
  "level": "foundation",
  "primarySkill": "discovery",
  "secondarySkills": [
    "communication"
  ],
  "tags": [
    "onboarding",
    "retention",
    "b2c"
  ],
  "brief": {
    "role": "Вы продакт направления роста в «Темпе».",
    "company": "«Темп» — вымышленное приложение для отслеживания привычек: 900 тысяч активных пользователей в месяц, команда 40 человек.",
    "context": "Десять дней назад новый онбординг выкатили на всех: было девять экранов, стало четыре — постановку цели и создание первой привычки убрали в само приложение. Завершение регистрации выросло с 61% до 78%, и это отпраздновали. Вчера аналитик сообщил, что недельное удержание у новой когорты заметно ниже. Руководитель продукта ждёт рекомендацию на завтрашней встрече.",
    "objective": "Не потерять удержание первой недели и по возможности сохранить прирост регистраций.",
    "constraints": "Двое разработчиков на спринт. Данных десять дней, полных недельных когорт две, и одна из них ещё не закрыта.",
    "task": "Решите, что делать дальше, и назовите, чем вы жертвуете."
  },
  "evidenceCards": [
    {
      "id": "funnel",
      "title": "Воронка и удержание",
      "type": "quantitative",
      "content": "Старый поток (за четыре недели до выпуска): завершение регистрации 61%, удержание на 7-й день 34%, на 30-й — 19%.\n\nНовый поток (десять дней): завершение 78%, удержание на 7-й день 27%.\n\nАктивных пользователей на 1 000 визитов: было 207, стало 211 — разница внутри шума, который аналитик оценил в ±14.\n\nРазрез по новому потоку: кто завёл привычку в первую сессию — удержание 41%, кто не завёл — 12%. В старом потоке привычка была у 88% к концу регистрации, в новом — у 46% к концу первого дня.\n\nПримечание аналитика: «Десять дней — это одна с небольшим когорта. Плюс на третий день нас показали в подборке магазина приложений, это около 30 тысяч установок».",
      "order": 1
    },
    {
      "id": "interviews",
      "title": "Пять разговоров с новыми пользователями",
      "type": "qualitative",
      "content": "Исследователь провёл пять двадцатиминутных звонков с теми, кто прошёл новый поток.\n\nТрое из пяти сказали, что после регистрации приложение выглядит «пустым». Двое из этих троих не смогли объяснить, для чего оно.\n\nДвое к моменту звонка привычку завели: оба сами нашли кнопку «плюс» в первую минуту и оба внятно описали, зачем им приложение.\n\nОдин, посмотрев запись старого потока, сказал, что тот «бесконечный», и новый ему нравится больше — хотя привычку он так и не создал.\n\nЧетверо из пяти установили приложение в те дни, когда шла подборка магазина.",
      "order": 2
    },
    {
      "id": "engineering",
      "title": "Что говорит разработка",
      "type": "technical",
      "content": "Новый поток за флагом: вернуть всех на девять экранов можно за минуты, а не за день.\n\nЧастичный откат так не работает: постановку цели и создание привычки убрали одним изменением, и машина состояний переписана вокруг этого. Разделить обратно — примерно три дня плюс тестирование.\n\nКарточка на главном экране, которая подталкивает новичка создать первую привычку, — примерно день работы.\n\nОтдельного события «привычка создана в первой сессии» до выпуска не было: сегодняшний разрез собран задним числом по времени создания.",
      "order": 3
    },
    {
      "id": "business",
      "title": "Что вокруг",
      "type": "business",
      "content": "«Темп» продаёт подписку на 14-й день. Из дошедших до 14-го дня платят около 6%, и оплата сильно связана с наличием хотя бы одной активной привычки.\n\nЧерез три недели начинается платное привлечение, которое примерно удвоит поток новых на месяц; бюджет уже утверждён.\n\nРуководитель роста написала, что не хочет «лить бюджет в дырявое ведро».\n\nВыручка пока ничего не показывает: первая новая когорта дойдёт до 14-го дня только через четыре дня.",
      "order": 4
    }
  ],
  "decisionPrompt": "Что вы порекомендуете команде и от чего откажетесь?",
  "decisionOptions": [
    {
      "id": "habit-prompt",
      "label": "Оставить новый поток и подтолкнуть к первой привычке",
      "description": "Выпустить карточку на главном экране, которая ведёт новичка к созданию привычки, и смотреть, вернутся ли доля заведших привычку и удержание.",
      "consequence": "Карточка выходит через два дня. За две недели доля новичков с привычкой к концу первого дня растёт с 46% до 71%.\nУдержание на 7-й день в этой когорте — 33%, почти как в старом потоке, при завершении регистрации 76%. Оба числа сохранены.\nАналитик честно предупреждает, что эффект карточки пока не отделить от затухающей волны из магазина приложений, и вы соглашаетесь запустить платное привлечение с настоящей контрольной группой.\nКомпромисс: вы действовали по гипотезе, а не по подтверждённой причине, и точно узнаете ответ только на следующей когорте.",
      "decisionPoints": 25,
      "rubricNote": "Сильнее всего, когда названо, что разрез по привычке объясняет падение, и что решение проверяемо за две недели."
    },
    {
      "id": "split-revert",
      "label": "Вернуть в онбординг создание привычки",
      "description": "Потратить три дня разработки, разделить изменение и оставить короткую регистрацию без постановки цели, но с созданием первой привычки внутри.",
      "consequence": "Через четыре дня выходит поток из шести экранов: без цели, но с привычкой.\nЗавершение регистрации 71% — ниже 78%, выше прежних 61%. Удержание на 7-й день 33%.\nРешение верное по сути и дороже необходимого: тот же эффект давала карточка за день, а разница в том, что здесь вы платите тремя днями и частью прироста регистраций.\nК началу платного привлечения всё готово, и это главный выигрыш.\nКомпромисс: потрачен почти весь спринт на то, что можно было проверить дешевле.",
      "decisionPoints": 20,
      "rubricNote": "Верный диагноз, дорогое лечение. Балл выше, если ответ сравнивает три дня с однодневной карточкой."
    },
    {
      "id": "investigate",
      "label": "Ничего не менять и две недели изучать",
      "description": "Оставить поток как есть, дождаться второй полной когорты, провести ещё интервью и прийти с чистыми данными.",
      "consequence": "Через две недели данные действительно чище: удержание новой когорты 28%, разрез по привычке подтверждается.\nНо к этому моменту платное привлечение уже стартовало, и удвоенный поток новых прошёл через тот же онбординг — примерно 60 тысяч человек с удержанием 27% вместо 33%.\nРуководитель роста напоминает про своё письмо, и разговор получается тяжёлым.\nКомпромисс: осторожность обоснованна, но её цена — целая когорта, купленная за утверждённый бюджет.",
      "decisionPoints": 14,
      "rubricNote": "Кредит выше, если ответ учитывает срок платного привлечения."
    },
    {
      "id": "rollback",
      "label": "Откатиться на старый поток",
      "description": "Вернуть флаг на девять экранов, восстановить известное удержание и вернуться к переделке позже, уже с нормальным экспериментом.",
      "consequence": "Откат занимает минуты, удержание возвращается к 34%, завершение регистрации падает обратно к 61%.\nАктивных пользователей на 1 000 визитов остаётся столько же — 207 против 211: по этому числу вы вернулись туда же, откуда начали.\nПри этом разрез уже показывал, что дело не в числе экранов, а в отсутствии первой привычки, и это знание вы отложили.\nКомпромисс: безопасно и обратимо, но откачено всё изменение целиком вместо той его части, которая ломала удержание.",
      "decisionPoints": 12,
      "rubricNote": "Обратимость учтена, причина не выделена."
    }
  ],
  "rubric": {
    "referenceReasoning": "Сравнивать надо не удержание, а результат: активных пользователей на 1 000 визитов было 207, стало 211 — то есть новый поток не хуже и не лучше, он перераспределил потери. Причина видна в разрезе: удержание 41% у заведших привычку против 12% у остальных, а доля заведших упала с 88% до 46%. Значит ломает не число экранов, а исчезнувший шаг с первой привычкой, и это подтверждают разговоры: трое из пяти назвали приложение «пустым». Данных при этом мало и они грязные — десять дней, одна с небольшим когорта и волна установок из подборки магазина, поэтому решение должно быть дешёвым и проверяемым. Карточка на главном стоит день и бьёт ровно в найденную причину; трёхдневное разделение изменения делает то же самое дороже. Ждать две недели нельзя из-за платного привлечения через три недели: удвоенный поток пройдёт через тот же онбординг. Полный откат возвращает и потерянные регистрации, то есть отменяет и то, что работало.",
    "evidenceSignals": [
      "Сравнивает потоки по активным на 1 000 визитов, а не по одной метрике",
      "Находит разрез по первой привычке: 41% против 12%",
      "Связывает падение с исчезнувшим шагом, а не с числом экранов",
      "Учитывает волну установок из подборки магазина как искажение",
      "Замечает, что полных когорт всего одна с небольшим",
      "Держит в уме срок платного привлечения через три недели"
    ],
    "positiveSignals": [
      {
        "lessonId": "d1-feedback-matrix",
        "skill": "discovery",
        "signal": "Группирует сообщения по тому, что человек делал, а не по повторяющемуся слову"
      },
      {
        "lessonId": "d1-feedback-matrix",
        "skill": "discovery",
        "signal": "Считает аккаунты, а не сообщения, и замечает вклад одного активного автора"
      },
      {
        "lessonId": "d1-frequency-adoption",
        "skill": "discovery",
        "signal": "Разбирает среднее на распределение и называет получившиеся сегменты"
      },